{
  "intake_id": "090d3c78-a33f-429a-bd6c-becd7afef304",
  "timestamp_utc": "2026-02-11T17:10:10Z",
  "inputs": {
    "paths": [
      "/home/nevermore/cases/intake/evtx/Logs"
    ]
  },
  "classification": {
    "kind": "windows_evtx_dir",
    "confidence": "high",
    "recommended_pipeline": "chainsaw_evtx"
  },
  "signals": [
    "Logs:dir_contains_evtx_count:335",
    "Logs:dir_contains_evt_count:0",
    "Logs:security_evtx_present"
  ]
}