{
  "intake_id": "54c69a3c-1ba6-44c2-9ece-52363fe1d1ff",
  "timestamp_utc": "2026-03-03T22:49:07Z",
  "inputs": {
    "paths": [
      "/home/nevermore/cases/intake/evtx/Logs"
    ]
  },
  "classification": {
    "kind": "windows_evtx_dir",
    "confidence": "high",
    "recommended_pipeline": "chainsaw_evtx"
  },
  "signals": [
    "Logs:dir_contains_evtx_count:335",
    "Logs:dir_contains_evt_count:0",
    "Logs:security_evtx_present"
  ]
}